date,area,area_type,active_inventory,new_listings,new_pendings,closed_sales,median_list_ppsf,median_dom,months_supply,pct_price_cuts,hoa_excluded_count,sentiment,mortgage_rate_30y,notes,source,as_of
2026-06-12,san_diego_city,metro,,,,,687,23,,,,balanced,6.57,"BASELINE. Sale $/sqft $687 (-3.7% YoY); city median sale $954K 3-mo (-3.0%); SDAR attached median $680K (+1.5%) with attached DOM +24% YoY; inventory up ~14-24% YoY. Detached tight / attached softening.","Redfin; SDAR; CAR","May 2026"
2026-06-12,carmel_valley,micro,31,,,,843,50,,,,seller,6.57,"BASELINE. ~20 condos + 11 townhouses active (all prices); $400-750K low-HOA band very thin - most attached stock $950K-$1.3M; attached $/sqft ~$843; 22 homes sold past month; Cambria-type HOAs ~$275/mo exist.","Redfin neighborhood; local MLS pages","Jun 2026 (ppsf 2024)"
2026-06-12,utc,micro,50,,,,689,38,,,,buyer,6.57,"BASELINE. 50 condos active $325K-$1.65M; Q1-26 condo median sale $630K (-11.9% YoY; n=42); list median $689K at $689/sqft (-5% YoY); DOM 36-40. Best fit for scope band in San Diego.","Homes.com; SD CondoMania; Movoto","May-Jun 2026"
2026-06-12,loudoun_co,metro,783,,,,,13,1.8,,,seller,6.57,"BASELINE. May-26: 537 closed (+6.8% YoY), median sold $790K (+2.0%), DOM 13 (-7.1%), actives 783 (-8.8%), 1.8 months supply.","NVAR May 2026 release","May 2026"
2026-06-12,arcola,micro,7,,,,297,63,,,,seller,6.57,"BASELINE. Arcola: ~6 TH + 1 condo active past month, TH median list $682K, DOM 63; Stone Ridge: 11 pendings median $676K, 12 sold past month; 20105 $/sqft $297 (+6.3% YoY). Van Metre new Stone Ridge phase sales open Fall 2026. Watch: Stone Ridge TH advertising 2.5% VA-assumable loan.","Redfin; Zillow; Van Metre","Jun 2026"
2026-06-12,fairfax_co,metro,,,,,,25,,,,seller,6.57,"BASELINE. Median sold $813K 3-mo ending May (+3.4% YoY), DOM 25, 1500 May closings; NVAR/GMU forecast condo prices -2.7% in 2026 on rising HOA fees - county tight overall, condos the soft spot.","Redfin; NVAR/GMU forecast","May 2026"
2026-06-12,oakton_hs,micro,,,,,,25,,,,seller,6.57,"BASELINE. Oakton Mar-26 median sale $793K (n=34), DOM 25; Zillow typical value $1.10M (-1.2% YoY), median pending speed ~5 days; sub-$750K attached stock limited, concentrated in condos near Vienna Metro (22181/22031 edges). Verify school zoning per listing via FCPS locator.","Redfin; Zillow","Mar-May 2026"
2026-06-12,dallas,metro,3851,,,,,48,5.4,,,buyer,6.57,"BASELINE. City median sold $465K 3-mo ending Apr (+5.6%), DOM 48; DFW attached actives: TH 2138 (+3.7%) + condo 1713 (+9.0%) = 3851; TH median -4.3% YoY / condo -9.8%; months supply TH 5.4 / condo 7.7 - attached segment is buyer-favored despite citywide headline strength.","Redfin; Homes.com/CoStar; TRERC","Apr 2026"
2026-06-12,austin,metro,17123,,,,,75,5.9,52,,buyer,6.57,"BASELINE. ABoR-area 6/11: 17123 active / 5039 pending, median sold $460K, DOM 75, 51.95% of actives with a price cut, sold-to-list 97.75%; condos: median $390K (-6.5% YoY), 7.48 months supply, DOM 108, sold-to-list 95.74% (2100+ active condo listings). Deepest buyer market in scope.","Unlock MLS via TeamPrice; ABoR","Jun 11 2026"
